{
  "schemaVersion": "aw-investigation-export/1",
  "packageVersion": "aw-feature/1",
  "workspaceId": "11111111-1111-4111-8111-111111111111",
  "runId": "run_billable",
  "evaluationId": "eval_billable",
  "evaluationRevision": 1,
  "attemptId": "attempt_billable",
  "criterionId": "billable.criterion",
  "verdict": "fail",
  "reproductionKind": "response_only",
  "fullyReproducible": true,
  "createsBillableRun": true,
  "identities": {
    "suiteId": "customer.faq.non_commerce",
    "suiteRevisionId": "rev_pinned_faq_1",
    "suiteContentHash": "aaaaaaaaaaaaaaaaaaaaaaaaaaaaaaaaaaaaaaaaaaaaaaaaaaaaaaaaaaaaaaaa",
    "caseId": "faq.status-page"
  },
  "evidence": {
    "expected": { "facts": ["must not inspect"] }
  },
  "prerequisites": {}
}
