{
  "schemaVersion": "aw-investigation-export/1",
  "packageVersion": "aw-feature/1",
  "workspaceId": "11111111-1111-4111-8111-111111111111",
  "runId": "run_latest",
  "evaluationId": "eval_latest",
  "evaluationRevision": 1,
  "attemptId": "attempt_latest",
  "criterionId": "faq.status-page.required",
  "verdict": "fail",
  "reproductionKind": "response_only",
  "fullyReproducible": true,
  "createsBillableRun": false,
  "identities": {
    "suiteId": "customer.faq.non_commerce",
    "suiteRevisionId": "latest",
    "suiteContentHash": "aaaaaaaaaaaaaaaaaaaaaaaaaaaaaaaaaaaaaaaaaaaaaaaaaaaaaaaaaaaaaaaa",
    "caseId": "faq.status-page"
  },
  "evidence": {
    "expected": { "facts": ["The status page is https://status.example.test"] }
  },
  "prerequisites": {
    "mapping": { "prepare": false, "observe": false, "cleanup": false, "session": false }
  }
}
